{
  "$schema": "https://json-schema.org/draft/2020-12/schema",
  "$id": "https://hawkinsoperations.example/schemas/case-growth-index-v0.schema.json",
  "title": "Hoxline Case Growth Index v1",
  "type": "object",
  "additionalProperties": false,
  "required": [
    "schema_version",
    "generated_at",
    "repo_root",
    "proof_ceiling",
    "historical_snapshot",
    "current_authority",
    "snapshot_state",
    "source_revisions",
    "contradictions",
    "drift",
    "next_legal_action",
    "reproducibility_sha256",
    "repos_scanned",
    "repo_slot_accuracy",
    "source_files_scanned_count",
    "case_ids_discovered_count",
    "summary",
    "case_growth_health",
    "cases",
    "data_quality_notes",
    "boundary"
  ],
  "properties": {
    "schema_version": { "const": "case-growth-index-v1" },
    "generated_at": { "type": "string", "minLength": 1 },
    "repo_root": { "type": "string", "minLength": 1 },
    "proof_ceiling": { "const": "CASE_GROWTH_INDEX_CONTROLLED_REPO_AGGREGATION_ONLY" },
    "historical_snapshot": { "const": false },
    "current_authority": { "const": true },
    "snapshot_state": { "type": "object" },
    "source_revisions": {
      "type": "array",
      "minItems": 7,
      "maxItems": 7,
      "items": {
        "type": "object",
        "required": [
          "repository",
          "authority_role",
          "resolved_ref",
          "source_commit_sha",
          "source_path",
          "source_file_sha256",
          "source_freshness_state",
          "snapshot_freshness_state",
          "historical_snapshot",
          "current_authority",
          "missing_source_state",
          "dangling_reference_state",
          "contradictions",
          "drift",
          "next_legal_action"
        ],
        "properties": {
          "repository": { "type": "string" },
          "source_commit_sha": { "type": "string" },
          "source_path": { "type": "string" },
          "source_file_sha256": { "type": ["string", "null"] },
          "historical_snapshot": { "type": "boolean" },
          "current_authority": { "type": "boolean" },
          "missing_source_state": { "type": "boolean" },
          "dangling_reference_state": { "type": "boolean" }
        },
        "additionalProperties": true
      }
    },
    "contradictions": { "type": "array", "items": { "type": "object" } },
    "drift": { "type": "array", "items": { "type": "object" } },
    "next_legal_action": { "type": "string", "minLength": 1 },
    "reproducibility_sha256": { "type": "string", "pattern": "^[0-9a-f]{64}$" },
    "repos_scanned": {
      "type": "array",
      "items": { "type": "object" }
    },
    "repo_slot_accuracy": {
      "type": "object",
      "additionalProperties": false,
      "required": [
        "expected_repo_slots",
        "present_local_repos",
        "missing_local_repos",
        "github_org_root_exists",
        "hawkinsoperations_github_sibling_exists",
        "wording"
      ],
      "properties": {
        "expected_repo_slots": { "const": 7 },
        "present_local_repos": { "type": "integer", "minimum": 0, "maximum": 7 },
        "missing_local_repos": { "$ref": "#/$defs/string_array" },
        "github_org_root_exists": { "type": "boolean" },
        "hawkinsoperations_github_sibling_exists": { "type": "boolean" },
        "wording": { "type": "string", "minLength": 1 }
      }
    },
    "source_files_scanned_count": { "type": "integer", "minimum": 0 },
    "case_ids_discovered_count": { "type": "integer", "minimum": 0 },
    "summary": {
      "type": "object",
      "additionalProperties": false,
      "required": [
        "cases_total",
        "source_packages_count",
        "controlled_validations_count",
        "runtime_candidate_lanes_count",
        "private_runtime_evidence_captured_count",
        "scheduled_collector_lanes_count",
        "proof_records_count",
        "proofcards_count",
        "claim_authority_cases_count",
        "metrics_available_count",
        "public_safe_cases_count",
        "closed_cases_count",
        "blocked_claims_count",
        "cases_with_next_gate_count",
        "cases_missing_proof_record_count",
        "cases_missing_proofcard_count",
        "cases_not_public_safe_count",
        "unknown_state_count"
      ],
      "properties": {
        "cases_total": { "type": "integer", "minimum": 0 },
        "source_packages_count": { "type": "integer", "minimum": 0 },
        "controlled_validations_count": { "type": "integer", "minimum": 0 },
        "runtime_candidate_lanes_count": { "type": "integer", "minimum": 0 },
        "private_runtime_evidence_captured_count": { "type": "integer", "minimum": 0 },
        "scheduled_collector_lanes_count": { "type": "integer", "minimum": 0 },
        "proof_records_count": { "type": "integer", "minimum": 0 },
        "proofcards_count": { "type": "integer", "minimum": 0 },
        "claim_authority_cases_count": { "type": "integer", "minimum": 0 },
        "metrics_available_count": { "type": "integer", "minimum": 0 },
        "public_safe_cases_count": { "type": "integer", "minimum": 0 },
        "closed_cases_count": { "type": "integer", "minimum": 0 },
        "blocked_claims_count": { "type": "integer", "minimum": 0 },
        "cases_with_next_gate_count": { "type": "integer", "minimum": 0 },
        "cases_missing_proof_record_count": { "type": "integer", "minimum": 0 },
        "cases_missing_proofcard_count": { "type": "integer", "minimum": 0 },
        "cases_not_public_safe_count": { "type": "integer", "minimum": 0 },
        "unknown_state_count": { "type": "integer", "minimum": 0 }
      }
    },
    "case_growth_health": {
      "type": "object",
      "additionalProperties": false,
      "required": [
        "validation_coverage_percent",
        "proof_record_coverage_percent",
        "proofcard_coverage_percent",
        "scheduled_collector_coverage_percent",
        "runtime_candidate_coverage_percent",
        "metrics_coverage_percent",
        "public_safe_percent",
        "closed_case_percent",
        "blocked_claim_density",
        "next_gate_coverage_percent",
        "missing_proof_record_percent",
        "missing_proofcard_percent",
        "not_public_safe_percent",
        "overall_health_status",
        "strongest_lane",
        "weakest_lane",
        "top_bottlenecks",
        "recommended_next_build"
      ],
      "properties": {
        "validation_coverage_percent": { "type": "number", "minimum": 0 },
        "proof_record_coverage_percent": { "type": "number", "minimum": 0 },
        "proofcard_coverage_percent": { "type": "number", "minimum": 0 },
        "scheduled_collector_coverage_percent": { "type": "number", "minimum": 0 },
        "runtime_candidate_coverage_percent": { "type": "number", "minimum": 0 },
        "metrics_coverage_percent": { "type": "number", "minimum": 0 },
        "public_safe_percent": { "type": "number", "minimum": 0 },
        "closed_case_percent": { "type": "number", "minimum": 0 },
        "blocked_claim_density": { "type": "number", "minimum": 0 },
        "next_gate_coverage_percent": { "type": "number", "minimum": 0 },
        "missing_proof_record_percent": { "type": "number", "minimum": 0 },
        "missing_proofcard_percent": { "type": "number", "minimum": 0 },
        "not_public_safe_percent": { "type": "number", "minimum": 0 },
        "overall_health_status": {
          "enum": [
            "EARLY_PIPELINE_REAL",
            "CONTROLLED_VALIDATION_HEAVY",
            "RUNTIME_CANDIDATE_FORMING",
            "PROOF_GAP_DOMINANT",
            "PUBLIC_SAFE_BLOCKED",
            "UNKNOWN_WITH_REASON"
          ]
        },
        "strongest_lane": { "type": "string", "minLength": 1 },
        "weakest_lane": { "type": "string", "minLength": 1 },
        "top_bottlenecks": { "$ref": "#/$defs/string_array" },
        "recommended_next_build": {
          "enum": [
            "proof_record_backfill",
            "proofcard_backfill",
            "public_safe_candidate_review_packet",
            "runtime_signal_review_gate",
            "case_closure_contract",
            "external_reviewer_demo_packet",
            "hygiene_cleanup_only"
          ]
        }
      }
    },
    "cases": {
      "type": "array",
      "minItems": 1,
      "items": { "$ref": "#/$defs/case_row" }
    },
    "data_quality_notes": {
      "type": "array",
      "items": { "type": "string" }
    },
    "boundary": {
      "type": "object",
      "additionalProperties": false,
      "required": [
        "runtime_public_proof_claimed",
        "signal_public_proof_claimed",
        "customer_deployment_claimed",
        "production_readiness_claimed",
        "public_safe_runtime_proof_claimed",
        "ai_approval_claimed",
        "analyst_approval_claimed",
        "final_authorization_claimed",
        "website_rendering_treated_as_proof",
        "green_ci_treated_as_approval"
      ],
      "properties": {
        "runtime_public_proof_claimed": { "const": false },
        "signal_public_proof_claimed": { "const": false },
        "customer_deployment_claimed": { "const": false },
        "production_readiness_claimed": { "const": false },
        "public_safe_runtime_proof_claimed": { "const": false },
        "ai_approval_claimed": { "const": false },
        "analyst_approval_claimed": { "const": false },
        "final_authorization_claimed": { "const": false },
        "website_rendering_treated_as_proof": { "const": false },
        "green_ci_treated_as_approval": { "const": false }
      }
    }
  },
  "$defs": {
    "string_array": {
      "type": "array",
      "items": { "type": "string" }
    },
    "case_row": {
      "type": "object",
      "additionalProperties": false,
      "required": [
        "case_id",
        "detection_id",
        "case_kind",
        "source_status",
        "source_evidence_refs",
        "validation_status",
        "validation_evidence_refs",
        "runtime_candidate_status",
        "runtime_evidence_refs",
        "scheduled_collector_status",
        "scheduled_collector_evidence_refs",
        "signal_status",
        "signal_evidence_refs",
        "proof_record_status",
        "proof_record_path",
        "proofcard_status",
        "proofcard_path",
        "claim_authority_status",
        "blocked_claim_count",
        "blocked_claims",
        "public_safe_status",
        "case_state",
        "metrics_available",
        "metrics_refs",
        "last_updated",
        "next_gate",
        "evidence_confidence",
        "notes"
      ],
      "properties": {
        "case_id": { "type": "string", "minLength": 1 },
        "detection_id": { "type": ["string", "null"] },
        "case_kind": { "type": "string", "minLength": 1 },
        "source_status": { "type": "string", "minLength": 1 },
        "source_evidence_refs": { "$ref": "#/$defs/string_array" },
        "validation_status": { "type": "string", "minLength": 1 },
        "validation_evidence_refs": { "$ref": "#/$defs/string_array" },
        "runtime_candidate_status": { "type": "string", "minLength": 1 },
        "runtime_evidence_refs": { "$ref": "#/$defs/string_array" },
        "scheduled_collector_status": { "type": "string", "minLength": 1 },
        "scheduled_collector_evidence_refs": { "$ref": "#/$defs/string_array" },
        "signal_status": { "type": "string", "minLength": 1 },
        "signal_evidence_refs": { "$ref": "#/$defs/string_array" },
        "proof_record_status": { "type": "string", "minLength": 1 },
        "proof_record_path": { "type": ["string", "null"] },
        "proofcard_status": { "type": "string", "minLength": 1 },
        "proofcard_path": { "type": ["string", "null"] },
        "claim_authority_status": { "type": "string", "minLength": 1 },
        "blocked_claim_count": { "type": "integer", "minimum": 0 },
        "blocked_claims": { "$ref": "#/$defs/string_array" },
        "public_safe_status": { "type": "string", "minLength": 1 },
        "case_state": {
          "enum": [
            "SOURCE_ONLY",
            "CONTROLLED_VALIDATION",
            "PRIVATE_RUNTIME_CANDIDATE",
            "PRIVATE_RUNTIME_EVIDENCE_CAPTURED",
            "METRICS_AVAILABLE",
            "PUBLIC_SAFE_CANDIDATE_REVIEW",
            "PUBLIC_SAFE",
            "CLOSED",
            "BLOCKED_WAITING_NEXT_GATE",
            "UNKNOWN_WITH_REASON"
          ]
        },
        "metrics_available": { "type": "boolean" },
        "metrics_refs": { "$ref": "#/$defs/string_array" },
        "last_updated": { "type": "string", "minLength": 1 },
        "next_gate": { "type": "string", "minLength": 1 },
        "evidence_confidence": { "enum": ["LOW", "MEDIUM", "HIGH"] },
        "notes": { "$ref": "#/$defs/string_array" }
      }
    }
  }
}
