{
  "schema_version": "case-growth-index-v1",
  "generated_at": "2026-07-22T23:09:52Z",
  "repo_root": "HawkinsOperations",
  "proof_ceiling": "CASE_GROWTH_INDEX_CONTROLLED_REPO_AGGREGATION_ONLY",
  "historical_snapshot": false,
  "current_authority": true,
  "snapshot_state": {
    "freshness": "CURRENT",
    "historical_snapshot": false,
    "current_authority": true,
    "self_source_revision_semantics": "worktree-head-or-snapshot-commit-parent"
  },
  "source_revisions": [
    {
      "repository": ".github",
      "authority_role": "org command-center routing",
      "resolved_ref": "feature/hoxline-case-growth-convergence-v1",
      "source_commit_sha": "bed34b8704f476075d65ec50095bb37121cb635b",
      "source_parent_sha": null,
      "self_referential": false,
      "revision_scope": "authoritative_source_at_commit",
      "source_path": "scripts/verify-command-center-invariants.py",
      "source_file_sha256": null,
      "source_freshness_state": "MISSING_AUTHORITY_SOURCE",
      "snapshot_freshness_state": "CURRENT",
      "historical_snapshot": false,
      "current_authority": false,
      "missing_source_state": true,
      "dangling_reference_state": true,
      "contradictions": [],
      "drift": [],
      "next_legal_action": "restore .github/scripts/verify-command-center-invariants.py from its owning repository"
    },
    {
      "repository": "hawkinsoperations-detections",
      "authority_role": "detection source truth",
      "resolved_ref": "feature/hoxline-case-growth-convergence-v1",
      "source_commit_sha": "bed34b8704f476075d65ec50095bb37121cb635b",
      "source_parent_sha": null,
      "self_referential": false,
      "revision_scope": "authoritative_source_at_commit",
      "source_path": "detections/DETECTION_PROMOTION_MATRIX.yml",
      "source_file_sha256": "07d582de56b33c6e78d9ad8965cdfc635d87c1004ef1db75b9a7f1aa9fecbd61",
      "source_freshness_state": "WORKTREE_MODIFIED",
      "snapshot_freshness_state": "CURRENT",
      "historical_snapshot": false,
      "current_authority": true,
      "missing_source_state": false,
      "dangling_reference_state": false,
      "contradictions": [],
      "drift": [],
      "next_legal_action": "none; preserve source ownership"
    },
    {
      "repository": "hawkinsoperations-validation",
      "authority_role": "controlled validation truth",
      "resolved_ref": "feature/hoxline-case-growth-convergence-v1",
      "source_commit_sha": "bed34b8704f476075d65ec50095bb37121cb635b",
      "source_parent_sha": null,
      "self_referential": false,
      "revision_scope": "authoritative_source_at_commit",
      "source_path": "validation/VALIDATION_REGISTRY.yml",
      "source_file_sha256": "2c12c3e8348ce058d3e4dd8ef7c437c3c761cf73b540233f49d4c7f1dea045be",
      "source_freshness_state": "WORKTREE_MODIFIED",
      "snapshot_freshness_state": "CURRENT",
      "historical_snapshot": false,
      "current_authority": true,
      "missing_source_state": false,
      "dangling_reference_state": false,
      "contradictions": [],
      "drift": [],
      "next_legal_action": "none; preserve source ownership"
    },
    {
      "repository": "hawkinsoperations-platform",
      "authority_role": "platform contract truth",
      "resolved_ref": "feature/hoxline-case-growth-convergence-v1",
      "source_commit_sha": "bed34b8704f476075d65ec50095bb37121cb635b",
      "source_parent_sha": null,
      "self_referential": false,
      "revision_scope": "authoritative_source_at_commit",
      "source_path": "contracts/public-status-source-contract-v1.json",
      "source_file_sha256": null,
      "source_freshness_state": "MISSING_AUTHORITY_SOURCE",
      "snapshot_freshness_state": "CURRENT",
      "historical_snapshot": false,
      "current_authority": false,
      "missing_source_state": true,
      "dangling_reference_state": true,
      "contradictions": [],
      "drift": [],
      "next_legal_action": "restore hawkinsoperations-platform/contracts/public-status-source-contract-v1.json from its owning repository"
    },
    {
      "repository": "hawkinsoperations-proof",
      "authority_role": "proof and claim-boundary truth",
      "resolved_ref": "feature/hoxline-case-growth-convergence-v1",
      "source_commit_sha": "bed34b8704f476075d65ec50095bb37121cb635b",
      "source_parent_sha": null,
      "self_referential": false,
      "revision_scope": "authoritative_source_at_commit",
      "source_path": "proof/indexes/DETECTION_PROOF_STATUS_INDEX.yml",
      "source_file_sha256": "1ff1ec190570218bae05656abae8c619edc451b27700de3cf6da9ca8de364d08",
      "source_freshness_state": "WORKTREE_MODIFIED",
      "snapshot_freshness_state": "CURRENT",
      "historical_snapshot": false,
      "current_authority": true,
      "missing_source_state": false,
      "dangling_reference_state": false,
      "contradictions": [],
      "drift": [],
      "next_legal_action": "none; preserve source ownership"
    },
    {
      "repository": "hawkinsoperations-website",
      "authority_role": "rendering-only public status",
      "resolved_ref": "feature/hoxline-case-growth-convergence-v1",
      "source_commit_sha": "bed34b8704f476075d65ec50095bb37121cb635b",
      "source_parent_sha": null,
      "self_referential": false,
      "revision_scope": "authoritative_source_at_commit",
      "source_path": "public/data/public-status.json",
      "source_file_sha256": null,
      "source_freshness_state": "MISSING_AUTHORITY_SOURCE",
      "snapshot_freshness_state": "CURRENT",
      "historical_snapshot": false,
      "current_authority": false,
      "missing_source_state": true,
      "dangling_reference_state": true,
      "contradictions": [],
      "drift": [],
      "next_legal_action": "restore hawkinsoperations-website/public/data/public-status.json from its owning repository"
    },
    {
      "repository": "hoxline",
      "authority_role": "case-growth and fixture-review product truth",
      "resolved_ref": "feature/hoxline-case-growth-convergence-v1",
      "source_commit_sha": "bed34b8704f476075d65ec50095bb37121cb635b",
      "source_parent_sha": "0be75c48ea4269fd6f7726620bfd157c42c43e95",
      "self_referential": true,
      "revision_scope": "authoritative_sources_excluding_snapshot",
      "source_path": "src/hoxline/case_growth/collector.py",
      "source_file_sha256": null,
      "source_freshness_state": "MISSING_AUTHORITY_SOURCE",
      "snapshot_freshness_state": "CURRENT",
      "historical_snapshot": false,
      "current_authority": false,
      "missing_source_state": true,
      "dangling_reference_state": true,
      "contradictions": [],
      "drift": [],
      "next_legal_action": "restore hoxline/src/hoxline/case_growth/collector.py from its owning repository"
    }
  ],
  "contradictions": [
    {
      "code": "MISSING_AUTHORITY_SOURCE",
      "source_owner": ".github",
      "source_path": "scripts/verify-command-center-invariants.py",
      "expected": "existing authoritative source",
      "actual": "missing",
      "classification": "ACTIONABLE_DRIFT",
      "next_legal_action": "restore .github/scripts/verify-command-center-invariants.py from its owning repository"
    },
    {
      "code": "MISSING_AUTHORITY_SOURCE",
      "source_owner": "hawkinsoperations-platform",
      "source_path": "contracts/public-status-source-contract-v1.json",
      "expected": "existing authoritative source",
      "actual": "missing",
      "classification": "ACTIONABLE_DRIFT",
      "next_legal_action": "restore hawkinsoperations-platform/contracts/public-status-source-contract-v1.json from its owning repository"
    },
    {
      "code": "MISSING_AUTHORITY_SOURCE",
      "source_owner": "hawkinsoperations-website",
      "source_path": "public/data/public-status.json",
      "expected": "existing authoritative source",
      "actual": "missing",
      "classification": "ACTIONABLE_DRIFT",
      "next_legal_action": "restore hawkinsoperations-website/public/data/public-status.json from its owning repository"
    },
    {
      "code": "MISSING_AUTHORITY_SOURCE",
      "source_owner": "hoxline",
      "source_path": "src/hoxline/case_growth/collector.py",
      "expected": "existing authoritative source",
      "actual": "missing",
      "classification": "ACTIONABLE_DRIFT",
      "next_legal_action": "restore hoxline/src/hoxline/case_growth/collector.py from its owning repository"
    }
  ],
  "drift": [],
  "next_legal_action": "restore .github/scripts/verify-command-center-invariants.py from its owning repository",
  "repos_scanned": [
    {
      "repo": ".github",
      "path": ".github",
      "exists": true,
      "branch": "feature/hoxline-case-growth-convergence-v1",
      "dirty": true,
      "authority_boundary": "org metadata and reviewer routing only; not proof authority",
      "files_scanned": 1
    },
    {
      "repo": "hawkinsoperations-detections",
      "path": "hawkinsoperations-detections",
      "exists": true,
      "branch": "feature/hoxline-case-growth-convergence-v1",
      "dirty": true,
      "authority_boundary": "source package and source status authority only",
      "files_scanned": 5
    },
    {
      "repo": "hawkinsoperations-validation",
      "path": "hawkinsoperations-validation",
      "exists": true,
      "branch": "feature/hoxline-case-growth-convergence-v1",
      "dirty": true,
      "authority_boundary": "controlled validation authority only",
      "files_scanned": 7
    },
    {
      "repo": "hawkinsoperations-platform",
      "path": "hawkinsoperations-platform",
      "exists": true,
      "branch": "feature/hoxline-case-growth-convergence-v1",
      "dirty": true,
      "authority_boundary": "platform runtime-candidate, collector, receipt, and ledger contract authority only",
      "files_scanned": 4
    },
    {
      "repo": "hawkinsoperations-proof",
      "path": "hawkinsoperations-proof",
      "exists": true,
      "branch": "feature/hoxline-case-growth-convergence-v1",